{"execution_attempt_id":"attempt","key_id":"key","observation":{"reason":"cancelled"},"occurred_at_unix_ms":2000,"outcome":"not_started","policy_revision":"policy","request_id":"request","request_sha256":"bbbbbbbbbbbbbbbbbbbbbbbbbbbbbbbbbbbbbbbbbbbbbbbbbbbbbbbbbbbbbbbb","reservation_id":"reservation","runtime":{"backend":"cpu-reference","checkpoint_revision":"aaaaaaaaaaaaaaaaaaaaaaaaaaaaaaaaaaaaaaaa","model":"laya-english","runtime_generation":"generation","runtime_revision":"fixture-build"},"schema_version":"1","started_at_unix_ms":null,"tenant_id":"tenant","usage_event_id":"usage"}
