{"execution_attempt_id":"attempt","key_id":"key","observation":{"encoded_tokens":17,"execution_ms":7,"output_tokens":0,"question_rows":2,"queue_ms":3,"requests":1},"occurred_at_unix_ms":2000,"outcome":"completed","policy_revision":"policy","request_id":"request","request_sha256":"bbbbbbbbbbbbbbbbbbbbbbbbbbbbbbbbbbbbbbbbbbbbbbbbbbbbbbbbbbbbbbbb","reservation_id":"reservation","runtime":{"backend":"cpu-reference","checkpoint_revision":"aaaaaaaaaaaaaaaaaaaaaaaaaaaaaaaaaaaaaaaa","model":"laya-english","runtime_generation":"generation","runtime_revision":"fixture-build"},"schema_version":"1","started_at_unix_ms":2000,"tenant_id":"tenant","usage_event_id":"usage"}
